{
  "schemaVersion": "0.1.0",
  "requestId": "operator-live-readonly-request:mcp-tools-list-allowed",
  "operatorId": "operator:michael",
  "policyRef": "examples/scope-d/operator-live-readonly-policy.example.json",
  "targetRef": "synthetic-mcp-server:lab-tools-list",
  "surfaceKind": "mcp_discovery",
  "readMethod": "mcp_tools_list",
  "requestedAt": "2026-05-21T23:55:00Z",
  "liveConnectionRequested": true,
  "toolInvocationRequested": false,
  "promptExecutionRequested": false,
  "mutationRequested": false,
  "credentialAccessRequested": false
}
